{
  "version": "1.0",
  "domain": "myblog.com",
  "updated": "2026-04-01T00:00:00Z",
  "site_type": ["blog"],
  "description": "We allow AI agents to discover and cite our articles. AI training on our content is not permitted.",
  "permissions": {
    "training": "block",
    "search": "allow",
    "ai_input": "allow"
  },
  "bots": {
    "blocked": ["CCBot", "Google-Extended", "GPTBot"],
    "allowed": ["ChatGPT-User", "PerplexityBot"]
  },
  "contact": "editor@myblog.com"
}
